{
  "version": "0.8",
  "site": { "name": "Required Title from H1" },
  "types": {
    "Post": {
      "fields": {
        "title": { "type": "string", "required": true },
        "body": { "type": "markdown" }
      }
    }
  },
  "collections": { "posts": { "type": "Post" } },
  "singletons": {},
  "redirects": []
}
